{
  "I": {
    "canonical_mmo_id": "H:HYDROGEN_V2",
    "instance_id": "a3e6a4d75d5f2ff25837878cfca4d045",
    "representation_id": "H:HYDROGEN_V2:scalar",
    "invariant_digest": "a1b16a5a834054da4f4adacdcd39ae93be89c2a70953855301f863b81fd3a616"
  },
  "D": {
    "dependencies": [],
    "source_hashes": {
      "hydrogen_v2_chirality_field.npy": "e0166dff4da52ea9b839692068b84ecd10017dde2a298d716c8201c3b783e4f4",
      "hydrogen_v2_environment_admissibility.npy": "1957f88650fc052ab64fca8b5fc9bd7d2bb2b154073c3a6c6092ea7321e6a87d",
      "hydrogen_v2_closure_topology.npy": "6dd27d65a75d03d7ed735e739509ee51d132ec80bccd0d6929975ec2ec4efc13",
      "hydrogen_v2_pair_closure_topology.npy": "197cd074c39b2a25fd8694424a28004e6f03f313de00bb4776eddcc876da2ee2",
      "hydrogen_v2_mixed_closure_admissibility.npy": "7387250afc2c149040013ac1037291b41b13e9b04b90c753fa04340e7059ae74",
      "hydrogen_v2_polarization_shell.npy": "632a761a03620e7e576db827df6e438da25be780e4149a614e4a57f9249fc1c9",
      "hydrogen_v2_redistribution_resistance.npy": "0be14e9e4590d102ad54e1c178a4e016a24681254bd89f64696c84279f1ee601"
    },
    "parent_instance_id": null
  },
  "Chi": {
    "fabric_tag": 5508075522112768044,
    "region": {
      "start": 163840,
      "count": 32768
    },
    "segment_sha256": "28de7ca9ac451ecdf29d65bbea0e8a723a0fba394d3087a6c80f688c4cded682",
    "mapping_profile": "MMO_SCALAR_CHIRALITY_DENSE_V1",
    "roles": [
      "control"
    ]
  },
  "R": {
    "state": "LIVE",
    "history": [
      {
        "event": "LIVE",
        "timestamp_ns": 1787336439466470973,
        "segment_sha256": "28de7ca9ac451ecdf29d65bbea0e8a723a0fba394d3087a6c80f688c4cded682"
      }
    ],
    "parent_instance_id": null
  },
  "P": {
    "provenance": [
      {
        "source_hashes": {
          "hydrogen_v2_chirality_field.npy": "e0166dff4da52ea9b839692068b84ecd10017dde2a298d716c8201c3b783e4f4",
          "hydrogen_v2_environment_admissibility.npy": "1957f88650fc052ab64fca8b5fc9bd7d2bb2b154073c3a6c6092ea7321e6a87d",
          "hydrogen_v2_closure_topology.npy": "6dd27d65a75d03d7ed735e739509ee51d132ec80bccd0d6929975ec2ec4efc13",
          "hydrogen_v2_pair_closure_topology.npy": "197cd074c39b2a25fd8694424a28004e6f03f313de00bb4776eddcc876da2ee2",
          "hydrogen_v2_mixed_closure_admissibility.npy": "7387250afc2c149040013ac1037291b41b13e9b04b90c753fa04340e7059ae74",
          "hydrogen_v2_polarization_shell.npy": "632a761a03620e7e576db827df6e438da25be780e4149a614e4a57f9249fc1c9",
          "hydrogen_v2_redistribution_resistance.npy": "0be14e9e4590d102ad54e1c178a4e016a24681254bd89f64696c84279f1ee601"
        }
      }
    ],
    "receipts": [
      {
        "kind": "INSTANTIATION_PLAN",
        "plan_id": "4a88a4a3f47b5ee1427945fe06c495e1e63fdb15ffdc90e4c1377fde2749c386",
        "timestamp_ns": 1787336439466457894
      },
      {
        "kind": "SEGMENT_COMMIT",
        "payload_hash": "060af628d5d753caba72c9f64d50a56f126e8a26ef014310352be4a6a5d197e4",
        "file_sha256": "28de7ca9ac451ecdf29d65bbea0e8a723a0fba394d3087a6c80f688c4cded682",
        "record_count": 32768,
        "timestamp_ns": 1787336439466459045
      },
      {
        "kind": "REGION_COMMIT",
        "allocation": {
          "reservation_id": "525cf40f4b0352478eb96152",
          "owner": "a3e6a4d75d5f2ff25837878cfca4d045",
          "start": 163840,
          "count": 32768,
          "guard": 0,
          "state": "COMMITTED"
        },
        "timestamp_ns": 1787336439466459837
      }
    ],
    "adapter_version": "BRANE_M5_ADAPTER_V0_1"
  }
}
